,Unnamed: 0,Archive,Attendance,Contains_BOF,Newspaper Issue Date,Event_Date,Event_Location,Location,Newspaper,Notes,Organization_Hosting,Persons,Price_Event,Revenue,Unique_Reference_Number,MENU,Coordinates,Unnamed: 0.1,Date2,Library,Citation,File_Name
359,359.0,LOC Conundrum Supper,,,"June 10, 1909",,Methodist Church Parlors,"Newport, Washington",The Newport Miner,Menu included.,Young people,,,,,Menu: The Way the Small Boy Goes Down Hill. Fruit of the Hub. Cereal Compound. Loves' Token. Old Maids' Delight. Curious Composition. Brazilian Ale. Sliced Maple. Spring's Offering. Quivering Dainties. Bovine Relish. Colored Garnish. Hidden Tsars. Earth's Apples.,"[-117.0432583, 48.1796277]",,,,,"The Newport Miner June 10, 1909"
360,360.0,LOC Conundrum Supper,,,"March 13, 1909",,,"Clarksburg, West Virginia",The Clarksburg Daily Telegram,,,,,,,,"[-80.3445341, 39.2806451]",,,,,"The Clarksburg Daily Telegram March 13, 1909"
361,361.0,LOC Conundrum Supper,,,,,Town hall,"St. Johnsbury, Vermont",St. Johnsbury Caledonian,,Daughters of Rebecca at Galena,,,,,,"[-72.0150951, 44.4192249]",,,,,St. Johnsbury Caledonian nan
362,362.0,LOC Conundrum Supper,,,"October 28, 1897",,,"Dodge City, Kansas",The Globe-republican,"Same event is referenced in the Hutchinson gazette, October 28, 1897 AND The Chanute times, October 29, 1897",Ladies’ Aid,,,,,,"[-100.0170787, 37.7527982]",,,,,"The Globe-republican October 28, 1897"
363,363.0,LOC Conundrum Supper,,,"March 17, 1916",,Southern Marcantile building,"Welsh, Louisiana",The Rice belt journal,Contains eBOF; duplicate reference in the same issue and the same event is referenced in the issue from March 24,Epworth league,,,,,"A marine animal, Mixed up type, Tear drops, Go betweens, Berry juice, Maid of Orleans, A goat, A tight squeeze, Sad predicaments, Too good for you, A silenced squealer, Turns over and over.","[-92.8226453, 30.2360403]",,,,,"The Rice belt journal March 17, 1916"
364,364.0,LOC Conundrum Supper,,,"March 12, 1909",,,"Dakota City, Nebraska",Dakota County herald,Same event is referenced in the issue from March 19; event was postponed to a later date,Ladies’ Social Circle,,,,,,"[-96.41853, 42.4153516]",,,,,"Dakota County herald March 12, 1909"
365,365.0,LOC Conundrum Supper,,,"March 12, 1906",,Home of Mr and Mrs W. Lamsden,"Barton, Vermont",Orleans County Monitor,,The Ladies’ Aid Society of the Methodist Church,,,,,,"[-72.174317559118, 44.74844]",,,,,"Orleans County Monitor March 12, 1906"
366,366.0,LOC Conundrum Supper,,,,,Home of Mrs Robert Harbarker,"Harrisburg, Pennsylvania",The Star-Independent,,Mr And Mrs. HE Wilson,,,,,,"[-76.8861122, 40.2663107]",,,,,The Star-Independent nan
367,367.0,LOC Conundrum Supper,,,"March 18, 1921",,Home of Mr. And Mrs. HE Wilson,"Klamath Falls, Oregon",The Evening Herald,,,,,,,,"[-121.7816704, 42.224867]",,,,,"The Evening Herald March 18, 1921"
368,368.0,LOC Conundrum Supper,,,"March 11, 1908",,Church parlors,"Morrisville, Vermont",News and Citizen,,Lyceum League,,,,,,"[-72.5923686622929, 44.5591997]",,,,,"News and Citizen March 11, 1908"
369,369.0,LOC Conundrum Supper,,,,,,Montpelier,The Vermont Watchman,,Men of the Grand avenue Baptist church,,,,,,"[-72.575684, 44.260445]",,,,,The Vermont Watchman nan
370,370.0,LOC Conundrum Supper,,,"March 11, 1901",,Chapel,"Fair Haven, Connecticut",The daily morning journal and courier,Contains eBOF; Same event is referenced in the issues from March 13 and March 14,Ladies’ Aid society of the M.E. church,,,,,"1. Pearls cast among swine 2. The unruly member 3. Fruit of the vine, assorted sizes 4. A son of Noah 5. Berries roasted and boiled -sweetened to taste 6. Oil well before using 7. Boston's overthrow -old maid's friend 8. The wise beverage - good for all. 9. Many ingredients concreted-assorted 10. The mouse's friend 11. Ivory manipulators 12. A Texas steer -chopped and spiced 13. Shell fruit in layers -baked 14. Billy goat and Uneeda? 15. Pickled fruit -pastor's favorite.","[-72.8956569, 41.3112082]",,,,,"The daily morning journal and courier March 11, 1901"
371,371.0,LOC Conundrum Supper,,,"March 20, 1896",,Church rooms,"Williston, North Dakota",Williston graphic,,Women of the Methodist church,,,,,,"[-103.621814, 48.1465457]",,,,,"Williston graphic March 20, 1896"
372,372.0,LOC Conundrum Supper,,,"October 26, 1915",,Vestry,"Brattleboro, Vermont",The Brattleboro Daily Reformer,Also mentioned Oct 30.,"Robert E. Lee Council, No. 29, Daughters of Liberty,  and Iroquois Tribe, No. 24, Improved Order of Red Men",,,,,,"[-72.5578678, 42.8509152]",,,,,"The Brattleboro Daily Reformer October 26, 1915"
373,373.0,LOC Conundrum Supper,,,"October 26, 1907",,Jr. O. U. A M.  Hall at Harborton,"Accomac, Virginia",Peninsula Enterprise,,"Life Boat lodge No. 150, Independent Order of Good Templars",,,,,,"[-75.6654845, 37.7195742]",,,,,"Peninsula Enterprise October 26, 1907"
374,374.0,LOC Conundrum Supper,,,"March 11, 1895",,Hall in the Continental block,"Omaha, Nebraska",Omaha daily bee,,,,,,,,"[-95.9383758, 41.2587459]",,,,,"Omaha daily bee March 11, 1895"
375,375.0,LOC Conundrum Supper,,,"June 10, 1914",,Congregational vestry,"Staffordville, Connecticut",The Press,Same event is referenced in the issue from June 03,Daughters of Veterans,,,,,,"[-72.25869, 41.9939848]",,,,,"The Press June 10, 1914"
376,376.0,LOC Conundrum Supper,,,"March 10, 1916",,G.A.R. hall,"Detroit, Michigan",The Detroit times,,,,,,,,"[-83.0466403, 42.3315509]",,,,,"The Detroit times March 10, 1916"
377,377.0,LOC Conundrum Supper,,,"October 27, 1893",,Grange Hall,"South Londonerry, Vermont",The Londonerry Sifter,,,,,,,,,,,,,"The Londonerry Sifter October 27, 1893"
378,378.0,LOC Conundrum Supper,,,,,,"Boonville, Missouri",The Sedalia weekly bazoo,"December 26, 1893",YPSMW,,,,,,"[-92.7440277, 38.9751547]",,,,,The Sedalia weekly bazoo nan
379,379.0,LOC Conundrum Supper,,,"September 03, 1891",,,"St. Johnsbury, Vermont",St. Johnsbury Caledonian,,The grange,,,,,,"[-72.0150951, 44.4192249]",,,,,"St. Johnsbury Caledonian September 03, 1891"
380,380.0,LOC Conundrum Supper,,,"June 10, 1897",,The grange,"Waterbury, Connecticut",Waterbury Democrat,,Builders of the M.E. church and Mrs. H. Turner,,,,,,"[-73.0438362, 41.5538091]",,,,,"Waterbury Democrat June 10, 1897"
381,381.0,LOC Conundrum Supper,,,"June 08, 1910",,Lecture room of the church,"Woodbridge, New Jersey",Perth Amboy evening news,"Same event is referenced in the issues from June 2, May 31, June 09, and June 11; This newspaper contains a reference to another CS event as well",C.E. of Calvary church,,,,,,"[-74.2860007694445, 40.55418]",,,,,"Perth Amboy evening news June 08, 1910"
382,382.0,LOC Conundrum Supper,,,"March 15, 1901",,Residence of J.E. Eggleston,"Jarrettsville, Maryland",The aegis & intelligencer,Contains eBOF,Christian Endeavor society,,,,,"An American author, the Irish for tea, a part of the foot, a son of Noah, a color, to put under the ground, employment of some women and the dread of all, drawing with the mouth, a narrow bed, a kind of tree, part of a house and a letter, a favorite Oriental Beverage, a doll's composition, a personal pronoun, bivalvular mollusks with fire-works, married people, chopped stupidity, Staff of life, a popular resort, a carpenter's sgn, a lacking quantity in Jarrettsville and surrounding county, an accompanient to a cold, the delight of the lawyer, shopped contention, sumptuously seasoned, what Pharoah saw in a dream, parson prey, an insect and a letter.","[-76.4777422, 39.60455]",,,,,"The aegis & intelligencer March 15, 1901"
383,383.0,LOC Conundrum Supper,,,,,Christian church,"Rock Island, Illinois",Rock Island Argus,,Ladies of the Baptist church,,,,,,"[-90.5787477, 41.5094771]",,,,,Rock Island Argus nan
384,384.0,LOC Conundrum Supper,,,"June 08, 1910",,,"Metuchen, New Jersey",Perth Amboy evening news,,Y.P.S.C.E.,,,,,,"[-74.3632049, 40.5431598]",,,,,"Perth Amboy evening news June 08, 1910"
385,385.0,LOC Conundrum Supper,,,"March 15, 1895",,Residence of Miss Julia Thorp,"Nichols, Connecticut",The Newtown bee,,The Students of Academy Green,,,,,,"[-73.1612225, 41.2409299]",,,,,"The Newtown bee March 15, 1895"
386,386.0,LOC Conundrum Supper,,,"June 09, 1892",,Academy Green,"Burlington, Vermont",Burlington Weekly Free Press,,,,,,,,"[-73.2135472, 44.4762975]",,,,,"Burlington Weekly Free Press June 09, 1892"
387,387.0,LOC Conundrum Supper,,,,,Grace church,"Stafford, Connecticut",The Press,,,,,,,,"[-72.2889686, 41.9848183]",,,,,The Press nan
388,388.0,LOC Conundrum Supper,,,"March 15, 1894",,Church vestry,"Morrisville, Vermont",News and Citizen,,The Ladies’ Aid Society of the Westminster Presbyterian Church,,,,,,"[-72.5923686622929, 44.5591997]",,,,,"News and Citizen March 15, 1894"
389,389.0,LOC Conundrum Supper,,,"October 30, 1907",,Lecture room of the church,"Salt Lake City, Utah",The Salt Lake Tribune,,Ladies Aid Society,,,,,,"[-111.8904308, 40.7670126]",,,,,"The Salt Lake Tribune October 30, 1907"
390,390.0,LOC Conundrum Supper,,,"October 30, 1907",,Lecture Room of the Church,"Salt Lake City, Utah",The Salt Lake Herald,Event referred to on October 31 as well.,Y.P.S.C.E. of Westminster Presbyterian Church,,,,,,"[-111.8904308, 40.7670126]",,,,,"The Salt Lake Herald October 30, 1907"
391,391.0,LOC Conundrum Supper,,,"March 15, 1892",,,"Sacramento, California",The record-union,Contains eBOF; event is also referenced on the March 16 issue,Ladies Aid Society,,,,,"Supper bill of fare: An Unruly Member, Pride of Boston, April Blossoms, A Young Man's Sweetheart, Impertinences, Fruit of the Vine, Tree Cake, Spring's Offering, Lay of the Last Minstrel, Boston's Overthrow, One of Noah's Sons, No Grounds for Complaint, Prairie Flower, Raised in Town, Tramp Cake, Frozen Tree, What Some People Don't Know, Cake Hard to Beat.","[-121.4943996, 38.5815719]",,,,,"The record-union March 15, 1892"
392,392.0,LOC Conundrum Supper,,,"June 11, 1897",,Congregational parsonage,"Guildhall, Vermont",Essex County Herald,,Epworth League,,,,,,"[-71.5610294, 44.5651812]",,,,,"Essex County Herald June 11, 1897"
393,393.0,LOC Conundrum Supper,,,"March 15, 1905",,Church vestry,"St. Johnsbury, Vermont",St. Johnsbury Caledonian,,King’s Daughters and Sons and Ladies’ Aid Society,,,,,,"[-72.0150951, 44.4192249]",,,,,"St. Johnsbury Caledonian March 15, 1905"
394,394.0,LOC Conundrum Supper,,,"March 15, 1906",,E.L. Marshall’s,"West Randolph, Vermont",Herald and News,,,,,,,,"[-72.666321, 43.925099]",,,,,"Herald and News March 15, 1906"
395,395.0,LOC Conundrum Supper,,,"March 15, 1891",,West Side Westminster Presbyterian church,"St. Paul, Minnesota",St. Paul daily globe,,Ladies of West Nottingham Presbyterian Church,,,,,,"[-93.1015026, 44.9504037]",,,,,"St. Paul daily globe March 15, 1891"
396,396.0,LOC Conundrum Supper,,,"October 29, 1892",,Chapel adjoining the church,"Elkton, Maryland",The Cecil Whig,,Methodist Epworth league,,,,,,"[-75.8330934, 39.6065073]",,,,,"The Cecil Whig October 29, 1892"
397,397.0,LOC Conundrum Supper,,,"October 30, 1913",,League room of the M.E. church,"Exira, Iowa",Audubon County journal,Contains eBOF; same event is referenced in the issue from Oct. 23.,Ladies Aid society of the Bergen Point M.E. church,,,,,"Substantials: What some people don't know, Women of Grit, Heart throbs in vinegar, Split dead-head, Descendant of Noah, Chip of the old block, What you never will? do if you keep on doing as you are doing now, Salamagundi, Lirshman's? favorite. Desserts: Whip tips, Hidden tears, Fall of mankind, Floating Island, Cool Impudence, A tramp's breakfast, Young men's favorite fruit, What young men are fond of. Drinks: Bean soup, Nature's offering, Ivory manipulators.","[-94.8757758, 41.5905324]",,,,,"Audubon County journal October 30, 1913"
398,398.0,LOC Conundrum Supper,,,"October 29, 1892",,"Reynolds Memorial Chapel, No. 138 Avenue D","Jersey City, New Jersey",The Jersey City news,Same event is referenced in the issue from November 2,Maple Lodge,,,,,,"[-74.0776417, 40.7281575]",,,,,"The Jersey City news October 29, 1892"
399,399.0,LOC Conundrum Supper,,,,,Maple Lodge hall,"North Deering, Maine",The Portland daily press,,,,,,,,"[-70.2878269, 43.6998031]",,,,,The Portland daily press nan
400,400.0,LOC Conundrum Supper,,,"October 31, 1895",,E.J. Parmelee,"Burlington, Vermont",Burlington Weekly Free Press,,,,,,,,"[-73.2135472, 44.4762975]",,,,,"Burlington Weekly Free Press October 31, 1895"
401,401.0,LOC Conundrum Supper,,,"October 31, 1895",,Home of E. J. Parmelee,"Burlington, Vermont",Burlington Weekly Free Press,,,,,,,,"[-73.2135472, 44.4762975]",,,,,"Burlington Weekly Free Press October 31, 1895"
402,402.0,LOC Conundrum Supper,,,"March 16, 1893",,,"Burlington, Vermont",Burlington Weekly Free Press,,Ladies of the Methodist church,,,,,,"[-73.2135472, 44.4762975]",,,,,"Burlington Weekly Free Press March 16, 1893"
403,403.0,LOC Conundrum Supper,,,"September 08, 1892",,"Mr. Goebel’s store room, Catron block","Santa Fe, New Mexico",Santa Fe daily New Mexican,Same event is referenced in the issue from September 3,W.C.T.U.,,,,,,"[-105.9377997, 35.6869996]",,,,,"Santa Fe daily New Mexican September 08, 1892"
404,404.0,LOC Conundrum Supper,,,"June 29, 1900",,W.C.T.U. hall,"Forest Hill, Maryland",The aegis & intelligencer,,Ladies’ Aid society of the South Baptist church of Tottenville,,,,,,"[-76.387739, 39.5851063]",,,,,"The aegis & intelligencer June 29, 1900"
405,405.0,LOC Conundrum Supper,,,"September 08, 1905",,Lawn of the church,"Tottenville, New Jersey",Perth Amboy evening news,,The Strollers’ Club,,,,,,,,,,,"Perth Amboy evening news September 08, 1905"
406,406.0,LOC Conundrum Supper,,,"September 29, 1905",,Residence of Miss Mae F. Snodgrass,"Bel Air, Maryland",The aegis & intelligencer,,YPSCE and Ladies of the Congregational Church,,,,,,"[-76.3490396, 39.5355063]",,,,,"The aegis & intelligencer September 29, 1905"
407,407.0,LOC Conundrum Supper,,,"September 29, 1892",,,"Burlington, Vermont",Burlington Weekly Free Press,,Mrs. Minnie McCarty,,,,,,"[-73.2135472, 44.4762975]",,,,,"Burlington Weekly Free Press September 29, 1892"
408,408.0,LOC Conundrum Supper,,,"September 20, 1895",,Residence of Mrs. Minnie McCarty,"Alma, Michigan",Alma record,,Willing Workers,,,,,,"[-84.659727, 43.37892]",,,,,"Alma record September 20, 1895"
409,409.0,LOC Conundrum Supper,,,"June 21, 1916",,Schoolhouse,"Barton, Vermont",Orleans County Monitor,,Ladies of Christ church,,,,,,"[-72.174317559118, 44.74844]",,,,,"Orleans County Monitor June 21, 1916"
410,410.0,LOC Conundrum Supper,,,"September 20, 1900",,Town hall,"Salisbury, Connecticut",Connecticut western news,,,,,,,,"[-73.4212318, 41.983426]",,,,,"Connecticut western news September 20, 1900"
411,411.0,LOC Conundrum Supper,,,"March 04, 1897",,Parsonage,"West Randolph, Vermont",Herald and News,,Ladies of the Methodist Aid society,,,,,,"[-72.666321, 43.925099]",,,,,"Herald and News March 04, 1897"
412,412.0,LOC Conundrum Supper,,,"March 04, 1893",,Graney’s hall,"Coeur d’Alene, Idaho",The Coeur d’Alene press,“on the European plan”,Ladies of the Village Improvement Society,,,,,,"[-116.7811531, 47.6742994]",,,,,"The Coeur d’Alene press March 04, 1893"
413,413.0,LOC Conundrum Supper,,,"September 27, 1911",,Home of Mr and Mrs OB Exley,"St. Johnsbury, Vermont",St Johnsbury Caledonian,Menu included,N.D.G.W.,,,,,"Fruit of the Vine, Brazilian Beverage, Chips of the Block, Fall of Man, Goat, Eve's Temptation, Pride of Boston, Oriental Delight, Woman's Weapon, Oliver Twist, Liquid Bovine, Hashed Bovine, Spring's offering, Feline Sauce, Staff of Life, (Malay, Caucasian), Noah''s Son, Lot's Wife, Cramp and Colic Cure, Tumble.","[-72.0150951, 44.4192249]",,,,,"St Johnsbury Caledonian September 27, 1911"
414,414.0,LOC Conundrum Supper,,,"September 25, 1903",,National hotel,"Jackson, California",Amador ledger,,Ladies of Smith’s Chapel,,,,,,"[-120.7741018, 38.3488024]",,,,,"Amador ledger September 25, 1903"
415,415.0,LOC Conundrum Supper,,,"September 21, 1901",,Church in Upshur’s neck,"Accomac, Virginia",Peninsula Enterprise,,Ladies of the Presbyterian church,,,,,,"[-75.6654845, 37.7195742]",,,,,"Peninsula Enterprise September 21, 1901"
416,416.0,LOC Conundrum Supper,,,"June 23, 1899",,Residence of Dr. Hart,"Greenwood, Mississippi",The commonwealth,,Company F. of Goff’s Chapel,,,,,,"[-90.1795281, 33.5162315]",,,,,"The commonwealth June 23, 1899"
417,417.0,LOC Conundrum Supper,,,"June 25, 1897",,Wilson’s Art Studio,"Clarksburg, West Virginia",The Clarksburg Telegram,,Ladies’ Aid society of Bay View,,,,,,"[-80.3445341, 39.2806451]",,,,,"The Clarksburg Telegram June 25, 1897"
418,418.0,LOC Conundrum Supper,,,"September 22, 1900",,Gilpius’ Rocks,"Elkton, Maryland",The Cecil Whig,Same event is referenced in the issue from September 29,Ladies of the Congregational church,,,,,,"[-75.8330934, 39.6065073]",,,,,"The Cecil Whig September 22, 1900"
419,419.0,LOC Conundrum Supper,,,"March 02, 1894",,Bouton’s hall,"Georgetown, Connecticut",The Newtown bee,There is another CS reference (distinct) in this issue indicated with the February 16th issue,Ladies’ Aid society,,,,,,"[-73.4353070481373, 41.248775]",,,,,"The Newtown bee March 02, 1894"
420,420.0,LOC Conundrum Supper,,,"September 24, 1900",,Gilpin’s Rocks,"Bay View, Delaware",Evening journal,,The Ladies’ Aid Society of the M. E. Church,,,,,,"[-75.4013315, 38.6920451]",,,,,"Evening journal September 24, 1900"
421,421.0,LOC Conundrum Supper,,,"September 23, 1896",,Home of Mr and Mrs W. J. Krebs,"Wellington, Ohio",The Enterprise,Woman’s weapon,Young Ladies’ Aid Society,,,,,,"[-82.2179354, 41.1689421]",,,,,"The Enterprise September 23, 1896"
422,422.0,LOC Conundrum Supper,,,"September 24, 1897",,Town Hall,"Brattleboro, Vermont",Vermont Phoenix,,Baptist Young People,,,,,,"[-72.5578678, 42.8509152]",,,,,"Vermont Phoenix September 24, 1897"
423,423.0,LOC Conundrum Supper,,,"June 28, 1904",,Church,"Billings, Montana",The Billings gazette,Same event is referenced in the issue from July 1,Young Ladies of the Baptist Church,,,,,,"[-108.49607, 45.7874957]",,,,,"The Billings gazette June 28, 1904"
424,424.0,LOC Conundrum Supper,,,"September 23, 1896",,Residence of Dr. Whitlock,"Jonesborough, Tennessee",Herald and Tribune,,Young Ladies Aid Society,,,,,,"[-82.4734089, 36.2944928]",,,,,"Herald and Tribune September 23, 1896"
425,425.0,LOC Conundrum Supper,,,"September 24, 1897",,Town Hall,"South Londonderry, Vermont",The Londonderry Sifter,,Sterling High School Graduating Class,,,,,,"[-72.8142644, 43.1928538]",,,,,"The Londonderry Sifter September 24, 1897"
426,426.0,LOC Conundrum Supper,,,"March 01, 1912",,High school building,"Honesdale, Pennsylvania",The Citizen,,Ladies’ Aid Society,,,,,,"[-75.2587871, 41.5767552]",,,,,"The Citizen March 01, 1912"
427,427.0,LOC Conundrum Supper,,,"March 01, 1906",,Memorial Hall,"Burlington, Vermont",Burlington Weekly Free Press,,Christian Sunday school,,,,,,"[-73.2135472, 44.4762975]",,,,,"Burlington Weekly Free Press March 01, 1906"
428,428.0,LOC Conundrum Supper,,,"June 30, 1899",,,"Nemaha City, Nebraska",The Nebraska advertiser,,Ladies of the M.E. Church,,,,,,"[-95.8518344, 40.3837713]",,,,,"The Nebraska advertiser June 30, 1899"
429,429.0,LOC Conundrum Supper,,,"March 05, 1897",,,"Corvallis, Oregon",The Corvallis Gazette,,Mrs. M.E. Nuss,,,,,,"[-123.2620435, 44.5645659]",,,,,"The Corvallis Gazette March 05, 1897"
430,430.0,LOC Conundrum Supper,,,"March 05, 1899",,"Residence of Mrs. M.E. Nuss, 1231 Forest avenue","Kansas City, Missouri",Kansas City journal,Contains eBOF w/ answers; has another ‘visual musicians’ riddle game,Epworth League of the M.E. church south,,,,,Women of grit (sandwiches). One who embarked in the ark (cold boiled ham). New England specialty (baked beans). Fragrant beans from Arabia (coffee). Wood from a celebrated watering place (saratoga chips). Spring's offering (water). Boston's overthrow (tea). Klondike nuggets (lemon ice). Angel's food and devil's food (cake).,"[-94.5781416, 39.100105]",,,,,"Kansas City journal March 05, 1899"
431,431.0,LOC Conundrum Supper,,,"October 26, 1906",,Residence of Mr. and Mrs. S.B. Wilson,"DeLand, Florida",The DeLand weekly news,,The Epworth League,,,,,,"[-81.3031098, 29.0283213]",,,,,"The DeLand weekly news October 26, 1906"
432,432.0,LOC Conundrum Supper,,,"September 19, 1898",,,"Barton, Vermonbt",Orleans County Monitor,,Ladies of the WRC,,,,,,,,,,,"Orleans County Monitor September 19, 1898"
433,433.0,LOC Conundrum Supper,,,"February 25, 1898",,G.A.R Ball,"Mitchell, South Dakota",The Mitchell Capital,Also mentioned February 04.,Sunday School Association of Providence M.P. church,,,,,,"[-98.025379, 43.70953]",,,,,"The Mitchell Capital February 25, 1898"
434,434.0,LOC Conundrum Supper,,,"September 08, 1922",,Odd Fellows hall at Upper Cross Roads,"Bel Air, Maryland",The aegis & intelligencer,,Epworth League,,,,,,"[-76.3490396, 39.5355063]",,,,,"The aegis & intelligencer September 08, 1922"
435,435.0,LOC Conundrum Supper,,,,,M.E. Church,"Mineral Point, Wisconsin",Mineral Point Tribune,"Also mentioned April 23. Also mentioned in the Iowa County Democrat, April 22, 1892 issue.",,,,,,,"[-90.1842252, 42.8615791]",,,,,Mineral Point Tribune nan
436,436.0,LOC Conundrum Supper,,,"September 11, 1908",,Dr Coulter’s lawn,"Milbank, South Dakota",The Herald-Advance,,Ladies of All Souls’ Universalist church,,,,,,"[-96.635617, 45.219131]",,,,,"The Herald-Advance September 11, 1908"
437,437.0,LOC Conundrum Supper,,,"September 13, 1891",,,"St. Paul, Minnesota",St. Paul daily globe,,Ladies of the Southern Presbytarian Church,,,,,,"[-93.1015026, 44.9504037]",,,,,"St. Paul daily globe September 13, 1891"
438,438.0,LOC Conundrum Supper,,,"June 16, 1896",,Mrs. Mary Samuel’s lawn,"Mt. Sterling, Kentucky",The Mt. Sterling advocate,Contains eBOF; same event is referenced in the issue from June 09,Y.P.S.C.E,,,,,Menu: Settled Above Ground. Old Maid's Comfort. A Group of Islands. The Tenderest Lays of Summer. Greased Staff. Woman's Weapon. A Heathen Chince. Under the Rhine. What Successful Candidates Did. Hidden Tears. 20 cents. Something to Take. Congealed Noise. Congealed Juice of the Fruit of the Tropics. 15 cents.,"[-83.9431961, 38.0561079]",,,,,"The Mt. Sterling advocate June 16, 1896"
439,439.0,LOC Conundrum Supper,,,"September 13, 1891",,Disciples’ Church,"Wheeling, West Virginia",Wheeling Sunday Register,,WHMS of the First Methodist Church,,,,,,"[-80.7209149, 40.0639616]",,,,,"Wheeling Sunday Register September 13, 1891"
440,440.0,LOC Conundrum Supper,,,"March 09, 1906",,WHMS of the First Methodist Church Basement,"Corvallis, Oregon",Corvallis Gazette,"Menu included. Mentioned March 02, 06, 09.",Ladies’ Aid society,,,,,"Mount Hood, Women of Grit, A Descendant of Noah, Woman's Weapon, Lovers Antidote, A Girls Name with an Ad, Boston's Stronghold, Spring Offeringm A Dead Beat, Printers Horror, No Grounds for Complaint, Boston's Overthrow, Nuts Without Shells, Impertinence, Tabby's Party, A Young Man's Sweetheart, Lays of Ancient Rome Tears.","[-123.2620435, 44.5645659]",,,,,"Corvallis Gazette March 09, 1906"
441,441.0,LOC Conundrum Supper,,,"March 09, 1906",,Residence of Dr. Drennan,"Rathdrum, Idaho",The Rathdrum tribune,,,,,,,,"[-116.8969312, 47.8111504]",,,,,"The Rathdrum tribune March 09, 1906"
442,442.0,LOC Conundrum Supper,,,"March 08, 1907",,Home of R.H. Williams,"Bradford, Vermont",The United Opinion,,,,,,,,"[-72.129364, 43.992815]",,,,,"The United Opinion March 08, 1907"
443,443.0,LOC Conundrum Supper,,,"March 07, 1905",,Home of Misses Halsey,"Fredericksburg, Virginia",The Free-Lance,,Ladies’ Aid of the MF Church of Houlton,,,,,,"[-77.4605399, 38.3031837]",,,,,"The Free-Lance March 07, 1905"
444,444.0,LOC Conundrum Supper,,,"June 11, 1915",,,"St Helen’s, Oregon",St Helen’s Mist,,Ladies’ Aid society,,,,,,"[-122.8064922, 45.8640034]",,,,,"St Helen’s Mist June 11, 1915"
445,445.0,LOC Conundrum Supper,,,"March 07, 1903",,Odd Fellows’ Hall,"Caldwell, Idaho",The Caldwell tribune,,Oddgeninses club of the A.M.E. church,,,,,,"[-116.6894156, 43.6678736]",,,,,"The Caldwell tribune March 07, 1903"
446,446.0,LOC Conundrum Supper,,,,,,"Monmouth, Iowa",Iowa state bystander,,The Royal Neighbors,,,,,,"[-90.8798647, 42.07696]",,,,,Iowa state bystander nan
447,447.0,LOC Conundrum Supper,,,"March 06, 1903",,Hart’s hall,"Rathdrum, Idaho",The silver blade,Contains eBOF; Same event is referenced in the issue from March 13,Bethen Cornet Band,,,,,The following is the Bill of Fare: Brazilian Bean Juice. Counterfelts. Cut-Up Capers. Woman Weapon. Military Capsules. Lover's Delight. Monkeys Delight. Grant. Mixed Chinese Lemons. Nuggets Nut Breakers. Sky High.,"[-116.8969312, 47.8111504]",,,,,"The silver blade March 06, 1903"
448,448.0,LOC Conundrum Supper,,,18-Jan-06,,Cashing’s Hall,"West Randolph, Vermont",Herald and News.,,,,,,,,"[-72.666321, 43.925099]",,,,,Herald and News. 18-Jan-06
449,449.0,LOC Conundrum Supper,,,"March 06, 1896",,South Church,"St. Johnsbury, Vermont",St. Johnsbury Caledonian,,,,,,,,"[-72.0150951, 44.4192249]",,,,,"St. Johnsbury Caledonian March 06, 1896"
450,450.0,LOC Conundrum Supper,,,"March 05, 1908",,Church parlor,"Burlington, Vermont",Burlington Weekly Free Press,,Ladies’ Aid of Ebenezer M.E. church,,,,,,"[-73.2135472, 44.4762975]",,,,,"Burlington Weekly Free Press March 05, 1908"
451,451.0,LOC Conundrum Supper,,,"September 18, 1920",,Farmington,"Elkton, Maryland",The Cecil Whig,,Mr and Mrs Ed Anderson,,,,,,"[-75.8330934, 39.6065073]",,,,,"The Cecil Whig September 18, 1920"
452,452.0,LOC Conundrum Supper,,,"June 19, 1904",,The home of Mr and Mrs Ed Anderson,"Salt Lake City, Utah",The Salt Lake Herald,,Methodist Episcopal,,,,,,"[-111.8904308, 40.7670126]",,,,,"The Salt Lake Herald June 19, 1904"
453,453.0,LOC Conundrum Supper,,,"September 30, 1914",,Parrottsville High School,"Newport, Tennessee",The Newport Plain Talk,,The Fifth Ward Amusement Committee,,,,,,"[-83.1876578, 35.9670412]",,,,,"The Newport Plain Talk September 30, 1914"
