,'File' Attachments,Issue,Date,Newspaper,Notes,Place Published,Location,Record Number,Reference Type,Short Title,Title,Event Date,Reference Type,Archive
91,"internal-pdf://0337453822/The Vermont Watchman, January 11, 1899.pdf",,"January 11, 1899",The Vermont Watchman,,N/A,"Montpelier, Vermont",6647, Newspaper Article,Ladies Aid,Ladies Aid,"January 18, 1899",,LOC Conundrum Tea
92,"internal-pdf://3006968059/Virignia Citizen, April 12, 1901.pdf",,12-Apr-01,Virginia Citizen,,Residence of J.M. McCarty,"Irvington, Virginia",6673, Newspaper Article,The Ladies Aid Society of the Presbyterian Church,The Ladies Aid Society of the Presbyterian Church,"28 March, 1901",,LOC Conundrum Tea
93,"internal-pdf://0719885375/Virginian-Pilot, February 27, 1900.pdf",,27-Feb-00,Virginian-Pilot,,"Residence of Mrs. A.L. Blanks, No. 60, Outten street","Norfolk, Virginia",6666, Newspaper Article,Grace Baptist Church,Grace Baptist Church,27-Feb-00,,LOC Conundrum Tea
94,"internal-pdf://3829176414/Virginia-Pilot, March 29, 1899.pdf",,"March 29, 1899",Virginian-Pilot,,"Residence of Mrs M.S Hart, corner of Webster avenue and A street","Norfolk, Virginia",6665, Newspaper Article,The Epworth Endeavor Society of the Park View Methodist Church,The Epworth Endeavor Society of the Park View Methodist Church,"March 20, 1899",,LOC Conundrum Tea
95,"internal-pdf://4172670832/Warren Sheaf, October 31, 1917.pdf",,31-Oct-17,Warren Sheaf,,N/A,"Warren, Minnesota",6516, Newspaper Article,N/A,N/A,31-Oct-17,,LOC Conundrum Tea
96,"internal-pdf://1869470118/The Washington Herald, October 10, 1915.pdf",,10-Oct-15,The Washington Herald,,Lecture room of the church,"Washington, D.C.",6485, Newspaper Article,Epworth League of Grace Methodist Church,Epworth League of Grace Methodist Church,N/A,,LOC Conundrum Tea
97,"internal-pdf://4084960721/The Wheeling Daily Intelligencer, December 13.pdf",,"December 13, 1893",The Wheeling Daily Intelligencer,,St Luke’s Church,"Wheeling, West Virginia",6678, Newspaper Article,St Luke’s Church,St Luke’s Church,"December 15, 1893",,LOC Conundrum Tea
98,"internal-pdf://1776808927/The Worthington Advance, February 09, 1893.pdf",,"February 09, 1893",The Worthington Advance,,G.A.R. Hall,"Worthington, Minnesota",6513, Newspaper Article,Ladies of the Episcopal Church,Ladies of the Episcopal Church,"February 14, 1893",,LOC Conundrum Tea
99,,,,,,,,,,,,,,